ID,TYPE,NAME,STATUS,START TIME,DURATION,END TIME,DESCRIPTION,EPIC
1,EPIC,Java developer. Модуль #1,DONE,2022-11-30T10:00,PT240H,2022-12-10T10:01,спринт #1; спринт #2
4,EPIC,Java developer. Модуль #1,NEW,2022-12-26T10:00,PT120H,2022-12-31T10:00,спринт #3; спринт #4
2,SUBTASK,Спринт #1,DONE,2022-11-30T10:00,PT120H,2022-12-05T10:00,пройти теорию; создать счетчик калорий,1
3,SUBTASK,Спринт #2,DONE,2022-12-05T10:01,PT120H,2022-12-10T10:01,пройти теорию; автоматизировать бухгалтерию,1
7,SUBTASK,Спринт #4,NEW,2022-12-26T10:00,PT120H,2022-12-31T10:00,пройти теорию; доработать трекер задач,4

